Title,Film,Year,Singer,Composer,Lyricist,Lyrics
suquun dil ko mayassar gulosamar men nahiin,street singer,1938,saigal kanan devi saigal,rai chand boral,aarzoo lakhnawi,	suquun dil ko mayassar gulosamar men nahiin jo aashiyaan men hai apane vah baag bhar men nahiin	jahaan hai raaheguzar kah rahii hai chalatii saans suquun kii aur ummiid umar bhar bhii nahiin	na aasaraa ho jise duusaron kaa e hamadam vah aisaa dil hai ki jaise chiraag ghar men nahiin	paraae duhkh ko duhkh apanaa samajh le aur de saath bashar nahiin jo yah baat aarazuu bashar men nahiin 
kamasinii men dil pe gam kaa baar kyon,amrit manthan,1934,shanta apte chorus,keshavrao bhole,veer muhammedpuri,	kamasinii men dil pe gam kaa baar kyon	kamasinii men dil pe gam kaa baar kyon	vaa ye qismat paas gul ke kaar kyon	vaa ye qismat paas gul ke kaar kyon	tuut jab ummiid hii apanii gayii	tuut jab ummiid hii apanii gayii	bandh rahaa hai aansuon kaa taar kyon	bandh rahaa hai aansuon kaa taar kyon	dil huaa tukade to pahale baar men	dil huaa tukade to pahale baar men	phir bhii tiiron kii hai ye bauchhaar kyon	viir is diiwaanagii men hai mazaa	viir is diiwaanagii men hai mazaa	log kahate hain ise aazaar kyon	log kahate hain ise aazaar kyon	
din niike biite jaate hain sumaran kar siyaaraam naam,pooran bhagat,1933,saigal,r c boral,, aa aa	din niike biite jaate hain sumaran kar siyaaraam naam	din niike biite jaate hain sumaran kar siyaaraam naam	haan sumaran kar siyaaraam naam din niike biite jaate hain	kaun tumhaaraa kutambkabiilaa ye sab matalab kaa hai liilaa	kaun tumhaaraa kutambkabiilaa ye sab matalab kaa hai liilaa	jiitejii ke naate hain sab	jiitejii ke naate hain sab	jiitejii ke naate hain	sumaran kar siyaaraam naam din niike biite jaate hain	sumaran kar siyaaraam naam din niike biite jaate hain	sumaran kar siyaaraam naam din niike biite jaat	laakhchauraasii bhugat ke aayaa	laakhchauraasii bhugat ke aayaa	bade bhaagya maanus tan paayaa laakhchauraasii bhugat ke aayaa bade bhaagya maanus tan paayaa taa par bhii nahiin karii kamaaii	bade bhaagya maanus tan paayaa laakhchauraasii bhugat ke aayaa bade bhaagya maanus tan paayaa taa par bhii nahiin karii kamaaii	bade bhaagya maanus tan paayaa laakhchauraasii bhugat ke aayaa bade bhaagya maanus tan paayaa taa par bhii nahiin karii kamaaii	phir paachhe pachhataate hain are phir paachhe pachhataate hain	phir paachhe pachhataate hain are phir paachhe pachhataate hain	sumaran kar siyaaraam naam din niike biite jaate hain sumaran kar siyaaraam naam haan sumaran kar siyaaraam naam din niike biite jaat 
kaahe ko mohe chhere re beimanawaa,pukaar,1939,sardar akhtar chorus,mir sahab,kamal amrohi,	sa	kaahe ko mohe chhere re beimanawaa	kaahe ko mohe chhere re beimanawaa	kaahe ko mohe chhere	chher ke mohe pachhataiibe re	pachhataiibe re	pachhataiibe re	beimanawaa	kaahe ko mohe	raajaa tumahiin se haare	naajaa tumahii se lagiyaa lagaay	inake jaat morii dhobaniyaa	inake jaat morii dhobaniyaa	raajaa tumahii se	cholii dhulawaa ke chhoduu	chunarii rangawaa ke chhoduu	chunarii rangawaa ke chhoduu	angiyaa bandhawaa ke chhoduu	angiyaa bandhawaa ke chhoduu	raajaa raajaa	tumahii se lagiyaa lagaay	inake jaat morii dhobaniyaa	raajaa tumahii se lagiyaa lagaay	inake jaat morii dhobaniyaa	sa	galle tohe bhar daiin mere	bhar daiin mere	bhar daiin mere	mere ke mohe ghir jaibe re	ghir jaibe re	beimanawaa	kaahe ko mohe chhere re beimanawaa	kaahe ko mohe chhere 
suhaag kii raat aaii sajanii,adhikaar,1938,pahari sanyal,timir baran,munshi arzoo rasheed,	suhaag kii raat aaii sajanii kaahe bhare tore nainaa	suhaag kii raat aaii sajanii kaahe bhare tore nainaa	suhaag kii raat	aangan men toraa chaand hansat hai	aangan men toraa chaand hansat hai	pawan rachat madhu bain sajanii	pawan rachat madhu bain sajanii	kaahe bhare tore nainaa suhaag kii raat aaii sajanii kaahe bhare tore nainaa suhaag kii raat	phaagun men chit hot udaasii waahii ke sun bainaa	phaagun men chit hot udaasii waahii ke sun bainaa	sohii kaaran bhii udaasii dhar naa rai more nainaa haan sohii kaaran bhii udaasii dhar naa rai more nainaa sajanii dhar naa rai more nainaa suhaag kii raat aaii sajanii kaahe bhare tore nainaa suhaag kii raat	saajan tohe aan pukaare kaahe ghuunghat kaadhe	saajan tohe aan pukaare kaahe ghuunghat kaadhe	ankhiyan men sakhii kaajar phero	ankhiyan men sakhii kaajar phero	aan baso more nain suhaag kii raat aaii sajanii kaahe bhare tore nainaa suhaag kii raat 
mat bhuul musaafir tujhe jaanaa hii padegaa,devdaas,1935,k c dey,timir baran,kedar sharma,	devadaas tum kyaa sachmuch mujhe chhod kar jaa rahe ho	devadaas tum nahiin jaaoge nahiin nahiin main nahiin jaauungaa	aa mat bhuul musaafir tujhe jaanaa hii padegaa	aa mat bhuul musaafir tujhe jaanaa hii padegaa	aa mat bhuul musaafir tujhe jaanaa hii padegaa	phulawaarii jab phuul khile to phuulii nahiin samaatii hai apaniiapanii sundarataa par kaliikalii itaraatii hai shabanam hai jo roro kar shabanam hai jo roro kar har phuul ko ye samajhaatii hai	mat bhuul musaafir tujhe jaanaa hii padegaa mat bhuul musaafir	ek musaafirakhaanaa hai duniyaa ek musaafirakhaanaa hai	ek musaafirakhaanaa hai duniyaa ek musaafirakhaanaa hai	mohjaal men phans kar muurakh mohjaal men phans kar muurakh phir paachhe pachhataanaa hai gaafil ek din sabako yahaan se itanaa sah kar jaanaa hai	mohjaal men phans kar muurakh mohjaal men phans kar muurakh phir paachhe pachhataanaa hai gaafil ek din sabako yahaan se itanaa sah kar jaanaa hai	afasos naa jaanaa thaa ke jaanaa hii padegaa mat bhuul musaafir tujhe jaanaa hii padegaa 
terii gatharii men laagaa chor,dhoop chhaaon bhagya chakra,1935,k c dey,r c boral,pt sudarshan, terii gatharii men laagaa chor musaafir jaag zaraa jaag zaraa terii gatharii men laagaa chor musaafir jaag zaraa	musaafir jaag zaraa terii gatharii	aaja zaraa saa fitanaa hai ye tuu kahataa hai kitanaa hai ye	do din men ye badhakara hogaa munhphat aur munhzor	musaafir jaag zaraa terii gatharii	niinda men maala ganvaa baithegaa	apanaa aapa lutaa baithegaa phira piichhe kuchh nahiin banegaa	laakh machaaye shor musaafir jaag zaraa terii gatharii	
prem kii ho jayjay jiiwan hai ab sukhamay,chandidaas,1934,saigal uma shashi pahadi sanyal,r c boral,aga h kashmiri,	prem kii ho jayjay jiiwan hai ab sukhamay bhaag o aao jag khoyaa gan paayaa	prem kii ho jayjay jiiwan hai ab sukhamay bhaag o aao jag khoyaa gan paayaa	aashaa ke phuul khile hiraday se hiraday mile	aashaa ke phuul khile hiraday se hiraday mile	ek hai praan do kaayaa	ek hai praan do kaayaa	u	byog kii raat kii bhor bhaii phir	sury ne diip dikhaayaa	sury ne diip dikhaayaa	milan kaa shubh din aayaa	milan kaa shubh din aayaa	prem ne man kii gangaajamunaa ko sukhsangam pe milaayaa	prem ne man kii gangaajamunaa ko sukhsangam pe milaayaa	dhanydhany wo rachanaa jisane prem kaa nit gun gaayaa	dhanydhany wo rachanaa jisane prem kaa nit gun gaayaa	prem kii ho jayjay jiiwan hai ab sukhamay bhaag o aao jag khoyaa gan paayaa 
kyuun nainan se niir bahaae,toofaani toli reckless rogues,1937,waheedan bai,gyan dutt,p l santoshi,	kyuun nainan se niir bahaae kyuun nainan se niir	dekh hansegii duniyaa saarii bujh na sakegii piir	pagalii aaj bhulaa de man se saarii biitii baaten jinamen tuune sukh dekhaa thaa vah sapane kii baaten sapanaa kab ho sach paayaa hai yahii samajh rakh dhiir kyuun nainan se	aankhon ke andar aansuu kii nadiyaa ek bahaa le naam piyaa kaa japatejapate sajanii kuub nahaa le hansate hue dubaa de isamen apanii saarii piir muurakh kyuun nainan se	
roshan hai tere dam se duniyaa kaa pariikaanaa,devdaas,1935,pahari sanyal,timir baran,kedar sharma,	roshan hai tere dam se duniyaa kaa pariikaanaa	roshan hai tere dam se duniyaa kaa pariikaanaa	roshan hai tere dam se duniyaa kaa pariikaanaa	allaah tujhe rakhe o jalawaa re jaanaanaa	allaah tujhe rakhe o jalawaa re jaanaanaa	roshan hai tere dam se duniyaa kaa pariikaanaa roshan hai tere dam se	kyaa jalawaagarii hai ye o mast nazar waale	kyaa jalawaagarii hai ye o mast nazar waale	paimaane ke andar hai mayakaane kaa mayakaanaa	paimaane ke andar hai mayakaane kaa mayakaanaa	roshan hai tere dam se duniyaa kaa pariikaanaa roshan hai tere dam se	zaahid ke taassub se sab qafr kaa barapaa hai	zaahid ke taassub se sab qafr kaa barapaa hai	varanaa butakaane men kaabaa hai kaabe men hai butakaanaa	varanaa butakaane men kaabaa hai kaabe men hai butakaanaa	roshan hai tere dam se duniyaa kaa pariikaanaa roshan hai tere dam se 
tumhiin ne mujhako prem sikhaayaa,manmohan,1936,surendra nath bibbo,ashok ghosh anil biswas,zia sarhadi, su	tumhiin ne mujhako bi	main andar aa sakatii huun su	prem sikhaayaa	tumhiin ne mujhako prem sikhaayaa	soye huye hiraday ko jagaayaa	bi	main kahatii huun main andar aa sakatii huun	su	ek naii duniyaa men basaayaa bi	ek naii duniyaa men basaayaa su	mast banaayaa ruup dikhaayaa bi	mast banaayaa ruup dikhaayaa su	tumhiin ho ruupsingaar baalam bi	tumhiin ho ruupsingaar baalam do	tumhiin ho ruupsingaar baalam	tumhiin ho ruupsingaar	tumhiin ne mujhako prem sikhaayaa	soye huye hiraday ko jagaayaa	soye huye hiraday ko jagaayaa	
bharane de mohe niir,izzat,1937,ashok kumar devika rani,saraswati devi,j s kashyap natawa,	de	bharane de mohe niir	bharane de mohe niir	bharane de mohe niir	hat chhaad dagar	morii dhiith langar	phuutii jaat gagar	naahiin mose jhagar	naahiin mose jhagar	bharane de mohe niir	bharane de mohe niir	bharane de mohe niir	a	badii niir bharan vaari	aaii braj naari	baaribaari matavaarii	baaribaari matavaarii	de	morii dori na pakar	bharane de mohe niir	bharane de mohe niir	bharane de mohe niir	hat kaanh muraarii	nahiin tohe duungii gaarii a	badii gaarii dene vaarii	dekhuun de to sahii gaarii de	natakhat a	chal hat de	panaghat a	jhatapat de	hat chhod dagar	bharane de mohe	bharane de mohe niir	bharane de mohe niir	bharane de mohe niir	bharane de mohe niir	
more anganaa men aaye aalii main chaal chaluun matawaalii,vidyapati,1937,kanan devi,r c boral,kedar sharma,	anganaa men aaye aalii main chaal chaluun matawaalii	anganaa men aaye aalii main chaal chaluun matawaalii	anganaa men aaye aa	ai sunatii ho sunosuno un un mujhase kah rahe hain haan ye kaise giit gaa rahii hai kyuun jii ye to bade achchhe giit hain achchhe giit hain raadhaakishan ke prem ke giit hain raadhaakishan ke prem ke giit hain sunaao to suniyegaa baithiye baithiye aaiiye baithiye uh uh uh uh uh ah ha ha ha ha ha suniye raadhikaa apanii sahelii se kah rahii hai ke jab shrii krishn	more anganaa men aaye aalii main chaal chaluun matawaalii anganaa men aaye aa	jab aanchal hamaraa pakade ham hanshans unase bache	jab aanchal hamaraa pakade ham hanshans unase bache	cholii pe najariyaa aa jaaye cholii pe najariyaa jaaye morii chunarii lipat mose jaaye haan haan chunarii lipat mose	bas bas rahane do tum mithilaa kii bahuubetiyon kaa satyaanaas karake chhodogii cholii pe uf	jii zaraa sun to liijiye aur kyaa ab bhii kuchh baakii hai hum	wo aur badhen more paiyaan paden kahen maano baat hamaarii	wo aur badhen more paiyaan paden kahen maano baat hamaarii	main aah bharuun mukh pher kahuun	main aah bharuun mukh pher kahuun	nahiin maanuungii baat tehaarii haan nahiin maanuungii baat tehaarii nahiin maanuungii baat tehaarii tehaarii nahiin maanuungii baat tohaarii haan nahiin maanuungii baat tehaarii tumhaarii 
yuun dard bhare dil kii awaaz sunaayenge,kapal kundala,1938,pankaj mullick,pankaj mullick,arzoo, yuun dard bhare dil kii aawaaz sunaayenge bedard ke dil ko bhii hamadard banaayenge	gangaa se mile jamanaa aur mil ke bahen donon haan hogaa agar aansuu saaqiir dikhaayenge	ai aarzauu aap aa kar jo de gaye yaad apanii ab koii bulaaye bhii to paar ko aayenge 
yaad terii aaii hai kaalii ghataa chhaaii hai,nadi kinaare on the river,1939,gyan dutt,gyan dutt,,	yaad terii aaii hai kaalii ghataa chhaaii hai more sajanavaa aajaa	chalii pachchhim kii havaa thes lagii dil men huaa dard savaa ab bhii na aaen sanam to donon kii rusavaaii hai yaad terii aaii	aramaan bharaa dil hai tarasaaii huiin ankhiyaan aankhon men samaaii hain sharamaaii huiin ankhiyaan yaad terii aaii	
naa koii prem kaa rog lagaaye,president,1937,k l saigal,pankaj mallick,unknown, naa koii prem kaa rog lagaaye	 naa koii prem kaa rog lagaaye	 naa koii prem kaa rog lagaaye	 naa koii prem kaa rog lagaaye	paapii angang rach jaaye	paapii angang rach jaaye	naa koii prem kaa rog lagaaye	prem kaa rog lagaaye	premii ke is bholepan par	sab duniyaa muskaaye	roop ke jis ko man men rakh kar	aag se aag bujhaaye	naa koii prem kaa rog lagaaye	galii galii priitam ko dhuundhe	jag se aankh bachaaye	man men jii bharbhar ke roye	aankhon men muskaaye	naa koii prem kaa rog lagaaye	
kyuun hamane diyaa dil,vatan,1938,sitara,anil biswas,wajahat mirza,	kyuun hamane diyaa dil	thaa kisakaa ishaaraa aur kisane kahaa thaa ab tumase kahen kyaa kyuun hamane diyaa dil	vo kvaab men aanaa dil meraa churaanaa aur kah ke ye jaanaa kyuun kaisaa liyaa dil	paravaanaa na jalataa kyuun sholaa jalaataa phir isakaa gilaa kyaa kaahe ko diyaa dil 
kudaa rakkhe aabaad jiivan tumahaaraa,toofaani taarzan,1937,ahmad dilawar,master mohammed,pt gyan, kudaa rakkhe aabaad jiivan tumahaaraa haan ho jaae amar	gulshan tumaharaa	milaa jo naa bastii men ban men vo paayaa khilaa hai ummidon kaa gulshan tumhaaraa	muhabbat se jangal men mangal banaa do bharaa hai muraadon se daaman tumahaaraa	chalaa kaaravaan kush rahoo bulabulo tum phale phuule haradam ye gulshan tumahaaraa	kush raho kush raho kush raho
song of life in the worlds broadfield of battle,duniya na maane the unexpected,1937,shanta apte,keshavrao bhole,h w longfellow,	comments the film duniya na manne was also made in in the bivouac of life be not dumb driven cattle be a hero in the strife	let us then be up and doing with a heart for any fate still achieving still pursuing learn to labor and to wait	not enjoyment and not sorrow is our destined end or way but to act that each tomorrow find us farther than today	let us then be up and doing	we can make our lives sublime and departing leave behind us footprints on the sands of time	footprints that perhaps another sailing oer lifes solemn main a forlorn and shipwrecked brother seeing shall take heart again	let us then be up and doing 
raajaa toraa paniyaan hamase na bharaa jaay re,zehree saanp,1933,jehanara kajjan,brajlal verma,pt narayan prasad betab,	raajaa toraa paniyaan hamase na bharaa jaay re	baalii umariyaa sar pe gagariyaa patalii kamariyaa tiintiin bal khaay re raajaa toraa paniyaan	kaise bharuun main jhukjhuk paanii ai rii sakhii morii uthatii javaanii cholii nigodii morii ang naa samaay re raajaa toraa paniyaan	
piyaa bin naahiin aavat chainaa,devdaas,1935,saigal,timir baran,kedar sharma,	piyaa bin naa bin naa hiin aavat chainaa	piyaa bin naa naahiin aavat chainaa	kaase kahuun jii ke bainaa kaa se kahuun jii ke bainaa	piyaa bin naa aahiin aavat chainaa	kaa se kahuun jii ke bainaa piyaa binaa naahiin aavat chainaa 
terii dayaa se ai dayii,nartaki,1939,pankaj,pankaj mullick,pt bhushan, terii dayaa se ai dayii aaj muraad mil gayii man kii nadii men aayii baad mauj uthii naii naii	chaman hans rahaa hai bahaar aa rahii hai har ek khilatii konpal bikasatii kalii hai hawaa mast hai aur gul khil rahe hain jidhar aankh uthaao kushii hii kushii hai	honthon pe aa gayii hansii dil kii kalii bhii khil gayii aaj muraad mil gayii aaj muraad mil gayii	
piyaamilan ko jaat huun,vidyapati,1937,k c dey pahari sanyal kanan devi k c dey,r c boral,kedar sharma,	pa	piyaamilan ko jaat huun sajdhaj siish gundhaay	piyaamilan ko jaat huun sajdhaj siish gundhaay	log kahat main baanwarii sab jag hansii udaay	sab jag hansii udaay	sab jag hansii udaay	kaa	wo kyaa jaane	jo marane se ghabaraaye	wo kyaa jaane prem kii dhun	jo marane se ghabaraaye	o mahaaraaj aap abhii tak khade hain puujaa kii tayyaarii nahiin hogii tumhen kyon kar maaluum huaa ki puujaa kii tayyaarii karanii hogii kuub itane dinon se main isii ghadii kaa intazaar kar rahii thii main jaanatii thii ki wo din aayegaa jab aapake raajaa aur merii raanii ek saath kahenge puujaa kii tayyaarii karo is puujaa ke liye mandir men mujhe bhii le chalo anuraadhaa chalo madhusuudan daadaa anuraadhaa utho sandhyaa hote hii prediip jalegaa devadaasii nritya karengii tum giit gaaoge bhagawaan jaag uthenge bhakton ko dekh kar muskaraayenge	girataa hai	girataa hai	naadaan sambhal	naadaan sambhal	kyuun girataa hai	kyuun girataa hai	jag kii maayaa	jag kii maayaa	phenk rahii hai	jag kii maayaa	pa	lo priit kii jiit hai jiitaa jag	lo priit kii jiit hai jiitaa jag	jo bichhade the wo mil jaayen kaa	lo priit kii jiit hai jiitaa jag	lo priit kii jiit hai jiitaa jag	jo bichhade the wo mil jaayen pa	tuu tuu na rahe kaa	main main na rahuun do	tuu tuu na rahe main main na rahuun	kuchh aise ham ghulmil jaayen	tuu tuu na rahe main main na rahuun	tuu tuu na rahe main main na rahuun	pa	kuchh aise ham ghulmil jaayen 
jalate hain aramaan meraa dil rotaa hai,anaarkali,1935,noorjehan,hussain,saif, katatii nahiin hai gam kii raat aake thahar gayii hai kyaa niind to khair kho gayii maut bhii mar gayii hai kyaa	jalate hain aramaan meraa dil rotaa hai kismat ka dasatuur niraalaa hotaa hai	jalate hain aramaan meraa dil rotaa hai kismat ka dasatuur niraalaa hotaa hai	kaun mere tuute dil ki fariyaad sunii kaun sunii kaun mere tuute dil ki fariyaad sunii aaj merii taqadiir kaa maalik sotaa hai kismat ka dasatuur niraala hotaa hai jalate hain aramaan meraa dil rotaa hai kismat ka dasatuur niraala hotaa hai	haay aise mauj se saahil chhuut gayaa chhuut gayaa	haay aise mauj se saahil chhuut gayaa varanaa apanii kashtii kaun dubotaa hai kismat ka dasatuur niraala hotaa hai jalate hain aramaan meraa dil rotaa hai kismat ka dasatuur niraala hotaa hai 
main tere gale kii maalaa,gramophone singer,1938,surendra nath bibbo,anil biswas,zia sarhadi, su	main tere gale kii maalaa	main tere gale kii maalaa	main tere gale kii maalaa	main tere gale kii maalaa	main tere gale kii maalaa	main tere gale kii maalaa	bi	tuu saagar main sariitaa	tuu saagar main sariitaa	tuu kavi main kaviitaa	tuu saagar main sariitaa	tuu kavi main kaviitaa	su	tuu merii nazar kii jwaalaa	tuu merii nazar kii jwaalaa	main tere gale kii maalaa	main tere gale kii maalaa	bi	main tere gale kii maalaa	main tere gale kii maalaa	do	main tere gale kii maalaa	main tere gale kii maalaa	su	diipak ban sansaar jalaa de	diipak ban sansaar jalaa de	aag lagaa de aag lagaa de	aag lagaa de aag lagaa de	diipak ban sansaar jalaa de	diipak ban sansaar jalaa de	bi	hans aur hans kar prem sikhaa de	hans aur hans kar prem sikhaa de	prem sikhaane waalaa	tuu prem sikhaane waalaa	main tere gale kii maalaa	main tere gale kii maalaa	su	main tere gale kii maalaa	main tere gale kii maalaa	do	main tere gale kii maalaa	main tere gale kii maalaa	
main man kii baat bataauun,dhartimata,1938,saigal uma shashi,pankaj mullick,pt sudarshan, u	man kii baat bataauun	main man kii baat bataauun	kyaakyaa baat uthat man more	kyaakyaa baat uthat man more	sab kah kar samajhaauun	main man kii baat bataauun	phuul banuun	phuul banuun	phuulan ang mahakuun bansii banakar gaauun	param puniit prabhaat banuun main jaaguun aur jagaauun	nipat suhaanii dhuup banuun main jaaguun aur jagaauun	main man kii baat bataauun	jaag banuun aakaash sajaauun taare roz jalaauun	lahar banuun pal pal laharaauun baadal ban jag chhaauun	lahar banuun pal pal laharaauun baadal ban jag chhaauun	s	tuu baadal kaa ruup bane main chaatak ruup dhar aauun	tuu baadal kaa ruup bane main chaatak ruup dhar aauun	suukhaa pyaasaa khet banuun main	suukhaa pyaasaa khet banuun main	pal pal tujhe bulaauun	main man kii baat bataauun	main man kii baat bataauun	miithaa giit banuun jharane kaa nit nit sunat suhaauun	miithaa giit banuun jharane kaa nit nit sunat suhaauun	aashaa kaa sapanaa banakar	aashaa kaa sapanaa banakar	man tuute jod dikhaauun	main man kii baat bataauun	main man kii baat bataauun
chhalake ras kii gagariyaa bhaarii,ek hi raasta the only way,1939,anil biswas wahidan,anil biswas,pandit indra,	wahidan	chhalake ras kii gagariyaa bhaarii main matawaarii panihaarii mohe bhuul gaye banawaarii kunjan men kunjabihaarii	a	hai bharaa huaa dil sajanii	kyuun jhuuthii baat banaaye wa	ab kaun tumhen samajhaaye a	tore gaal laaj se laal	bhaal par bindiyaa musakaaye wa	baalam torii najar naa lag jaaye a	raslat gholii pyaarii 
raadhe raadhe banshii rahii pukaar,kangan,1939,arun kumar,saraswati devi,pt narottam vyas,	raadhe raadhe banshii rahii pukaar	raadhe raadhe banshii rahii pukaar	mathuraa jaate nand kumaar	mathuraa jaate nand kumaar	raadhe raadhe banshii rahii pukaar	raadhe raadhe banshii rahii pukaar	bansiibat par jamunaatat par	bansiibat par jamunaatat par	rahe wo baat nihaar kaanhaa rahe wo baat nihaar milane jaat piyaa se milane milane aakhirii baar raadhe yahii aakhirii baar	rahe wo baat nihaar kaanhaa rahe wo baat nihaar milane jaat piyaa se milane milane aakhirii baar raadhe yahii aakhirii baar	raadhe yahii 
na aayaa man kaa miit umariyaa biit gaii saarii,devdaas,1935,k c dey,timir baran,kedar sharma,	na aayaa man kaa miit umariyaa biit gaii saarii	na aayaa man kaa miit umariyaa biit gaii saarii	umariyaa biit na aayaa man kaa miit umariyaa biit gaii saarii umariyaa biit	aahat paa kar koii la raahii	kahate hain logo aate hain	kahate hain logo aate hain	dhokhaa khaane waale nayanaa haradam dhokhaa khaate hain re dhokhaa khaane waale nayanaa haradam dhokhaa khaate hain aashaa aur niraashaa men is aashaa aur niraashaa men sab rahii umariyaa biit	na aayaa man kaa miit umariyaa biit gaii saarii umariyaa biit	tum kaun ho paaravatii kush raho	naahiin padat mohe piir na chainaa pii ke daras ko tarasat nai naaaa	naahiin padat mohe piir na chainaa pii ke daras ko tarasat nainaa	naahiin padat mohe piir na chainaa pii ke daras ko tarasat nainaa	palpal chhinchhin dhalatedhalate palpal chhinchhin dhalatedhalate gaii umariyaa biit	na aayaa man kaa miit 
jag maa hii jugjug jiyo,pukaar,1939,female voice,mir sahab,kamal amrohi,	jag maa hii jugjug jiyo jiyo sadaa tum naam	jiyo sadaa tum naam sadaa tum suphal rahe har kaam	jiyo sadaa tum naam sadaa tum suphal rahe har kaam	jag maa hii jugjug jiyo jiyo sadaa tum naam 
ek bangalaa bane nyaaraa,president,1937,saigal,r c boral,, ek bangalaa bane nyaaraa rahe kumba jis men saaraa	sone kaa bangalaa chandan kaa jangalaa vishvakarmaa ke dvaare ati sundar pyaaraa pyaaraa ek bangalaa	itanaa uunchaa bangalaa ho ye maano gagan kaa taaraa	itanaa uunchaa bangalaa ho ye maano gagan kaa taaraa	itanaa uunchaa bangalaa ho ye maano gagan kaa taaraa	jis pe chadh ke indradhanushh par jhuulaa jhuule chaand hamaaraa bhandaar hoye lachhamii ke haathon men saaraa paae ab jii bhar ke sukh jisane bipat uthaaii 
jaavojaavo e mere saadhuu raho guruu ke sang,pooran bhagat,1933,k c dey,r c boral,,	aa jaavojaavo e mere saadhuu raho guruu ke sang	aa jaavojaavo e mere saadhuu raho guruu ke sang	solah baras par aaye the ik din shaant rahe ham log	solah baras par aaye the ik din shaant rahe ham log	ab phir chhod chale ham sabako	ab phir chhod chale ham sabako	kaho ye kaun hai dhang jaavojaavo e mere saadhuu raho guruu ke sang	kaho ye kaun hai dhang jaavojaavo e mere saadhuu raho guruu ke sang	jitanii duur bhii jaao rahoge hiraday hii ke samiip	jitanii duur bhii jaao rahoge hiraday hii ke samiip	aise hii tum har ik yug men	aise hii tum har ik yug men	badalo har ik rang jaavojaavo e mere saadhuu raho guruu ke sang	badalo har ik rang jaavojaavo e mere saadhuu raho guruu ke sang	jaavo parameshwar ko bhajate karo bhalaaii sabakii	jaavo parameshwar ko bhajate karo bhalaaii sabakii	sab sansaarii jud jaayenge	sab sansaarii jud jaayenge	puuran naam ke sang jaavojaavo e mere saadhuu raho guruu ke sang	puuran naam ke sang jaavojaavo e mere saadhuu raho guruu ke sang	solah baras par aaye the ik din shaant rahe ham log	solah baras par aaye the ik din shaant rahe ham log	ab phir chhod chale ham sabako kaho ye kaun hai dhang jaavojaavo e mere saadhuu raho guruu ke sang 
kahaan wo bachapan kaa pyaaraa sapanaa,adhikaar,1938,pahari sanyal pankaj mullick,timir baran,munshi arzoo rasheed,	kahaan wo bachapan kaa pyaaraa sapanaa	kahaan wo bachapan kaa pyaaraa sapanaa	swarg bharii wo prem kii rainaa	swarg bharii wo prem kii rainaa	kahaan wo bachapan kaa pyaaraa sapanaa	bagiyan men miljul ke jaanaa phuulon kaa wo mahal banaanaa	bagiyan men miljul ke jaanaa phuulon kaa wo mahal banaanaa	dulhaadulhan ban byaah rachaanaa	dulhaadulhan ban byaah rachaanaa	aanchal dhal ko jan men phiranaa pyaaraa sapanaa kahaan wo bachapan kaa pyaaraa sapanaa	haay achaanak huaa saveraa jag maayaa ne man ko gheraa	haay achaanak huaa saveraa jag maayaa ne man ko gheraa	ujad gayaa wo rain baseraa	ujad gayaa wo rain baseraa	tuut gayaa hanson kaa dainaa	tuut gayaa hanson kaa dainaa	kahaan wo bachapan kaa pyaaraa sapanaa	swarg bharii wo prem kii rainaa	swarg bharii wo prem kii rainaa	kahaan wo bachapan kaa pyaaraa sapanaa	ab wo din hain na prem kii raaten yaad magar hain pyaar kii baaten	ab wo din hain na prem kii raaten yaad magar hain pyaar kii baaten	man lene kii bholii ghaaten	man lene kii bholii ghaaten	laaj bhare tore do nainaa	laaj bhare tore do nainaa	pyaaraa sapanaa 
lelo lelo lelo koii gajaraa lelo,dharmaveer,1937,ratnaprabha,annasaheb mainkar,, lelo lelo lelo koii gajaraa lelo raajaajii kii maalan aayii laayii champaa kii maalaa	juuhii mogaraa belaa gulaab ye alabelaa ye joban mastaanii dekho raat kii raanii in kaliyon men daalii kin gaalon kii laalii	phuul churaaye khuub sabere bhanware ruuthe hain mujhase	ye taajaa haar chamelii kaa shringaar hai naar navelii kaa jo ruuth gayii ho chandramukhii to le jaao ye suuryamukhii
