Title,Film,Year,Singer,Composer,Lyricist,Lyrics
kuchh aise bandhan hote hain jo bin baandhe,farishta ya qatil,1977,mukesh lata,kalyanjianandji,anjaan,  la 	 kuchh aise  2 bandhan hote hain jo bin baandhe bandh jaate hain mu 	jo bin baandhe bandh jaate hain vo jiivan bhar tadapaate hain 	kuchh aise bandhan threedots la 	kuchh aise bandhan threedots  	jaane ye kaisaa naataa hai jo bin jode jud jaataa hai 	ik din man kaa paagal panchhii bin pankh lage ud jaataa hai mu 	suuraj chhuune kii koshish men panchhii ke par jal jaate hain 	kuchh aise bandhan threedots la 	kuchh aise bandhan threedots  	jab pyaar kii tapatii raahon men do pyaase dil mil jaate hain 	phir dhuupchhaanv ban jaatii hai saanson men phuul khil jaate hain mu 	jaagii aankhon ke ye sapane aksar man ko chhal jaate hain 	kuchh aise bandhan threedots la 	kuchh aise bandhan threedots 
piine ke baad aatii hain yaad,bullet,1976,asha,r d burman,anand bakshi, mat chhed yaar gam kii baaten in baaton men dam nahiin 2  kaise ham jii rahe hain aise ham jii rahe hain 2 jaise koii zahar hai hansake ham pii rahe hain sote hue ye din guzare jaagate piite raaten kaii  piine ke baad aatii hain yaad bhuulii huii baaten kaii ho piine ke baad aatii hain yaad bhuulii huii baaten kaii  jaaduu se chal rahe hain aramaan nikal rahe hain 2 shole lapak rahe hain jinamen jii jal rahe hain palakon ke niiche in aankhon ke piichhe chhupii hain barasaaten kaii  piine ke baad aatii hain yaad bhuulii huii baaten kaii ho piine ke baad aatii hain yaad bhuulii huii baaten kaii  bhuulii huii baaten kaii
merii baat ke maane do,paise ki gudiyaa ghunghat aur ghungharoo,1974,kishore,laxmikantpyarelal,varma malik, merii baat ke maane do 2 jo achchhaa lage vo apanaa lo jo buraa lage use jaane do merii baat ke maane do  insaan ke saare jiivan men bas ek javaanii hotii hai   2 kabhii vo apanii hotii hai kabhii begaanii hotii hai kabhii begaanii hotii hai isii umr men aake to banate hain afasaane do jo achchhaa lage vo apanaa lo jo buraa lage use jaane do merii baat ke maane do  duniyaa jisako dil kahatii hai vo do rango kaa hotaa hai   2 mil jaaye to ye hansataa hai tuut jaaye to rotaa hai tuut jaaye to rotaa hai thukaraanaa hai thukaraa do milataa hai mil jaane do jo achchhaa lage vo apanaa lo jo buraa lage use jaane do merii baat ke maane do  ye cheharaa bhii ek darpan hai jo tasviiren dikhalaataa hai    man men hai khushiiyaan  kaii gam sab is pe nazar aa  aa  sab is pe nazar aa jaataa hai mere dil men jo baaten hai mujhko aaj bataane do jo achchhaa lage vo apanaa lo jo buraa lage use jaane do merii baat ke maane do
meharabaano qadaradaano  duniyaa men rahanaa hai to kaam karo,haathi mere saathi,1971,kishor,laxmikantpyarelal,anand bakshi,  meharabaano qadaradaano dosto yaaro are khel dekho khel one two three up  duniyaa men rahanaa hai to kaam karo pyaare haath jod sabako salaam karo pyaare varanaa ye duniyaa jiine nahiin degii khaane nahiin degii piine nahiin degii khel koii nayaa subahshaam karo pyaare duniyaa men rahanaa threedots  paise binaa duniyaa men rotii nahiin milatii rotii nahiin milatii langotii nahiin milatii haath jod sabako salaam karo pyaare duniyaa men rahanaa threedots  ek din teremere kvaab honge puure aisii koii baat kar chal o jamuure rah jaaen sab dil thaam kar o pyaare duniyaa men rahanaa threedots  taange men lagii jaisii ghodii chalii jaae rassii pe gorii aisii daudii chalii jaae chal ghar chalen raamraam karo pyaare duniyaa men rahanaa threedots 
diye jalate hain phuul khilate hain badii mushkil se magar,namak haraam,1973,kishore,r d burman,anand bakshi, diye jalate hain phul khilate hain badii mushkil se magar duniyaa men log milate hain  jab jis vaqt kisiikaa yaar judaa hotaa hain kuchh naa puchho yaaron dil kaa haal buraa hotaa hai dil pe yaadon ke jaise tiir chalate hain diye threedots  daulat aur javaanii ek din kho jaatii hai sach kahataa huun saarii duniyaa  dushman ban jaatii hai umr bhar dost lekin saath chalate hain diye threedots  is rangdhuup pe dekho haragij naaz naa karanaa jaan bhii maange yaar to de denaa naaraaz naa karanaa rang ud jaate hain dhuup dhalate hain diye threedots
kasam kyaa hotii hai  jo todii naa jaae bichhodii naa paae,qasam,1976,asha nitin mukesh,bappi lahiri,indivar, kasam kyaa hotii hai kasam vo hotii hai jo todii naa jaae bichhodii naa paae kasam kyaa hotii hai threedots  yaar bichhadane lagate hain to rab kii aankh bhii rotii hai kasam kyaa hotii hai threedots  terii kasam luun hamase jo ruuthii jaan se guzar jaaenge hii terii haan se jii uthenge naa se mar jaaenge hii baat baat men kasam kyaa khaanaa kasam mazaak nahiin hai kasam hai jitanii paak chiiz koii utanii paak nahiin hai dilon kaa sangam hai ho kasam gangaajal hai pyaar pe daag jo lag jaae to apane lahuu se dhotii hai kasam kyaa hotii hai threedots  dilon ke lie zaruurii nahiin hai duniyaa kii manzuurii kasam pyaar kii nahiin maanatii janmon kii bhii duurii tanhaaii ko mahakaatii hai yaadon kii kastuurii kasam hai vo jo har haalat men kii jaatii hai puurii kasam ik giitaa hai kasam vo siitaa hai raajamahal ke chhod ke sukh jo angaaron pe sotii hai kasam kyaa hotii hai threedots 
jaanii o jaanii jaldii se aajaa mil aake,raajaa jaani,1972,kishor,laxmikantpyarelal,anand bakshi,  jaanii o jaanii 3 jaldii se aajaa mil aake biitii jaae ye javaanii jaanii o jaanii threedots  bigadaa nasiibaa banane ke lie ek ishaaraa teraa kaafii hai 2 aashiq ke jiinemarane ke lie itanaa sahaaraa teraa kaafii hai tujhape lutaa duungaa mitaa duungaa main ye zindagaanii jaanii o jaanii threedots  aankhon men terii tasviir lie dhuundh rahaa huun tujhe raste men 2 terii galii men teraa diivaanaa bech rahaa dil saste men karake ye saudaa le jaa de jaa raanii dil kii nishaanii jaanii o jaanii threedots 
aaj ham apanii duaaon kaa asar dekhenge,pakeezah,1971,lata chorus,ghulam mohammad,kaif bhopali, aaj ham apanii duaaon kaa asar dekhenge tirenazar dekhenge zakhmejigar dekhenge 2  aap to aankh milaate hue sharamaate hain aap to dil ke dhadakane se bhii dar jaate hain phir bhii ye ziddh hai ke ham zakhmejigar dekhenge tirenazar dekhenge zakhmejigar dekhenge 2  pyaar karanaa dilebetaab buraa hotaa hai sunate aaye hain ke ye khvaab buraa hotaa hai aaj is kvaab kii taabiir magar dekhenge tirenazar dekhenge zakhmejigar dekhenge 2  jaanalevaa hai muhabbat kaa samaa aaj kii raat shamaa ho jayegii jal jal ke dhunaa aaj kii raat aaj ki raat bachenge to sahar dekhenge 2 tirenazar dekhenge zakhmejigar dekhenge 2
naukarii sau kii hazaar kii,aahuti,1978,kishore anuradha,laxmikant pyarelal,anand bakshi,  ki 	naukarii sau kii hazaar kii qiimat nahiin hotii pyaar kii 	pyaar anamol hai ek miithaa bol hai 	miithiimiithii baaten yaar kii 	naukarii sau kii threedots do 	naukarii sau kii threedots  ki 	mushqil raahon se aksar bachakar log nikalate hain 	phuulon ke jo aashiq hain vo kaanton pe chalate hain 	chhod ke galiyaan bahaar kii a 	naukarii sau kii threedots do 	naukarii sau kii threedots  a 	pyaar nahiin karataa koii daulat ke diivaanon se 	vo kyaa jaanen farq hai kyaa dil aur dukaanon men 	dil amaanat diladaar kii do 	naukarii sau kii threedots  ki 	barasegii ban ke ghataa ye apanii jo pyaas hai a 	ye apanii jo pyaas hai 	ham jaage usake lie ab vo subah paas hai ki 	vo subah paas hai do 	raat biitii intazaar kii 	naukarii sau kii threedots 
terii chhotii sii ek bhuul ne saaraa gulshan jalaa diyaa,shiksha,1978,yesudas,bappi lahiri,gauhar kanpuri, terii chhotii sii ek bhuul ne saaraa gulshan jalaa diyaa kyaa mahakenge phir phuul kabhii kyaa phir se bahaaren aaengii  jaane kahaan kii riit hai ye koii kare aur koii bhare nyaaya nahiin anyaaya hai ye doshii jie nirdosh mare sun le tuu ai qaafil  tujhase kahe teraa dil terii chhotii sii threedots  tuune andhere de ke ise chhiin lii nainon kii muskaan saanjh savere raat aur din isake lie ek samaan sun le tuu ai qaafil  tujhase kahe teraa dil terii chhotii sii threedots  tere chalan kii aandhii ne dekh le kitane ghar luute bikhar gae rishte naate jiivan ke saathii chhuute sun le tuu ai qaafil  tujhase kahe teraa dil terii chhotii sii threedots 
qasmevaade nibhaaenge ham,qasme vaade,1978,kishor lata,r d burman,gulshan bawra,  ki 	qasmevaade nibhaaenge ham 	milate rahenge janamjanam la 	o dekhaa maine tujhako to mujhe aisaa lagaa 	barason kaa soyaa huaa pyaar meraa jagaa 	tuu hai diiyaa main huun baatii aajaa mere jiivansaathii ki 	qasmevaade threedots  ki 	cheharon se hon anjaane ham dil to dil ko pahachaane 	kabhii pyaar nahiin marataa hai paagal premii ye jaane 	aa jaatii hai lab pe kud hii bhuuliibisarii baat 	qasmevaade threedots  la 	jis dil men pyaar basaa ho vo dil bhagavaan kii muurat 	ye muurat kabhii na badale badale insaan kii suurat 	dil ke bandhan itane sachche jitane ye din raat do 	qasmevaade threedots 
arre fashion kii diivaanii ye gudiyaan hain japaanii,adhikar,1971,manna dey and chorus,r d burman,ramesh pant, arre fashion kii diivaanii ye gudiyaan hain japaanii 2 kaun kahegaa bolo inako ladakii hindustaanii  bolo bolo bolo bolo bolo naa ko fashion kii diivaanii ye gudiyaan  hain japaanii kaun kahegaa bolo inako ladakii hindustaanii  kaanon tak baal kataake achchhii kaasii surat kaa  rakkhaa ye haal banaake 2 haath hain suune maathaa nangaa aankhen suramedaanii arre kaun kahegaa bolo inako ladakii hindustaanii  bolo bolo bolo bolo bolo naa ko fashion kii diivaanii threedots  taubaa taubaa ye beauty naqalii hai bilakul jhuuthii inase kii jisane shaadii usakii to qismat phuutii 2 duur se unako taakaa karanaa gar ho jaan bachhaanii arre kaun kahegaa bolo inako ladakii hindustaanii  bolo bolo bolo bolo bolo naa ko fashion kii diivaanii threedots  ko wauu  ik din is desh men naarii samajhii jaatii thii devii hoke ab biis baras kii ye kahalaatii hain baby 2 arre kaun kahegaa bolo inako ladakiii hindustaanii  bolo bolo bolo bolo bolo naa ko fashion kii diivaanii threedots 
terii tasaviir ko siine se lagaa rakhaa hai,saavan ko aane do,1979,yesudas,rajkamal,fauq jaami, pothii padh padh jag muaa pandit bhayaa na koy dhaaii akshar prem kaa padhe so pandit hoy  terii tasaviir ko siine se lagaa rakhaa hai hamane duniyaa se alag gaanv basaa rakhaa hai terii tasaviir ko   threedots  merii kismat kii lakiiron ko sajaayaa tuune ek naachiiz ko fanakaar banaayaa tuune main ne har bol teraa dil men sajaa rakhaa hai hamane duniyaa se   threedots  tujhako din raat khayaalon men hai puujaa main ne tere pairon ke nishaan par kiyaa sajadaa main ne bandagii men tere sar ab bhii jhukaa rakhaa hai hamane duniyaa se   threedots  main ne giiton se chhavi terii banayii barason duur rah kar tujhe aavaaz sunaayii barason kis liye tuu ne mujhe gair banaa rakhaa hai ham ne duniyaa se threedots 
o o ye dil le kar nazaraanaa aa gayaa teraa diivaanaa,ek baar muskuraa do,1972,mukesh asha,o p nayyar,s h bihari,  mu 	o o ye dil le kar nazaraanaa aa gayaa teraa diivaanaa 	dilabar jaanii na denaa dil tod tod tod aa 	ye pyaar hai gaharaa saagar hai duub ke tujhako jaanaa 	dilabar jaanii jaa jaa re pallaa chhod chhod chhod  	o o nasnas men hai bijalii kahiin jal naa jaanaa ko 	kahiin jal naa jaanaa jal naa jaanaa aa 	soch samajhakar hamase zaraa dil takaraanaa ko 	zaraa dil takaraanaa dil takaraanaa aa 	raah pyaar kii badii kathin hai kahaan chalaa mar jaane 	o dilabar jaanii jaa jaa re threedots  mu 	tuut pade yah bijalii to qismat chamake ko 	are qismat chamake qismat chamake mu 	aag men tap kar sonaa aur bhii damake ko 	are aur bhii damake aur bhii damake mu 	haarjiit kii baat pyaar men chalii kise samajhaane 	o dilabar jaanii na denaa threedots 
raaton ke saaye ghane jab bojh dil par bane,annadata,1972,lata,salil choudhary,yogesh, raaton ke saaye ghane jab bojh dil par bane  na to jale baatii na ho koii saathii  2  phir bhii na dar agar bujhen diye  sahar to hai tere liye			 2  jab bhii mujhe kabhii koii jo gam ghere lagataa hai honge nahiin sapane yah puure mere  2 kahataa hai dil mujhako maanaa hain gam tujhako phir bhii na dar agar bujhen diye sahar to hai tere liye  jab na chaman khile meraa bahaaron men jab duubane main laguun raaton kii majadhaaron men  2 maayuus man dole par yah gagan bole phir bhii na dar agar bujhen diye sahar to hai tere liye  jab zindagii kisii tarah bahalatii nahiin khaamoshiyon se bharii jab raat dhalatii nahiin  2 tab muskuraauun main yah giit gaauun main phir bhii na dar agar bujhen diye sahar to hai tere liye  raaton ke saaye ghane jab bojh dil par bane na to jalen baatii na ho koii saathii  2 phir bhii na dar agar bujhen diye sahar to hai tere liye 
naii rii lagan aur miithii batiyaan,alaap,1977,yesudas madhurani kumari faiyyaz,jaidev,dr rahi masoom reza,  naii rii lagan aur miithii batiyaan piyaa jaane aur jiyaa moraa jaane sakhii kis kis baat pe dhadake chhatiyaan piyaa jaane aur jiyaa moraa jaane sakhii   threedots  baal bhii ulajhe hain sapane bhii duuje laage hain apane bhii ho gaye ham kyon aise diivaane piyaa jaane aur jiyaa moraa jaane sakhii   threedots  kaagaa jaa jaa jaa jaa 2 jaa re kaagaa jaa jaa jaa jaa jaa re  na de more piyaa ko sandesavaa jaa jaa jaa re jaa re kaagaa jaa piyaa naahi aaye piyaa naahi aaye more aalii kaise kare man kab jaauun piyaa naahi aaye piyaa naahi aaye  barase badaraiyaa saavan kii saavan men gum kyon meraa manavaa bhanak sunii piyaa aavan kii umad ghumad chahuun dish so aayo bijurii chamake jhar laavan kii barase badaraiyaa saavan kii 
jaggeyaa jaggeyaa jaggeyaa kade ishq chhupan naiyon lageyaa,kaala patthar,1979,mahendra kapoor pamela chopra s k mahan chorus,rajesh roshan,sahir, ishq aur mushq kade na chhupade te chaahe lakh chhupaaiye oe akhaan lakh jhukaake chaliye te pallaa lakh bachaaiye  ishq aur mushq kade na chhupade te chaahe lakh chhupaaiye akhaan lakh jhukaake chaliye pallaa lakh bachaaiye ishq hai sachche rab dii rahamat ishq ton kyuun sharmaaiye chadhade chand ne chadhake rahanaa ho chadhade chand ne chadhake rahanaa kaannuu parde paaiye kaannuu parde paaiye  jaggeyaa jaggeyaa jaggeyaa kade ishq chhupan naiyon lageyaa  ho ho ho ho threedots aa aa aa aa aa threedots  duniyaa dii is bhiid de andar haan te duniyaa dii is bhiid de andar je koii apanaa paaiye apane nuun khushakismat kahiye rab daa shukar manaaiye dil badale dil milen te yaaraa threedots ho threedots  hoye dil badale dil milen te yaaraa saudaa jhat chukaaiye ambar te jo svarag base oe ambar te jo svarag base o dharatii te lai aaiye dharatii te lai aaiye  jaggeyaa jaggeyaa jaggeyaa kade ishq chhupan naiyon lageyaa  hoye threedots kade ishq chhupan naiyon lageyaa ho   threedots kade ishq chhupan naiyon lageyaa hoye threedots kade ishq chhupan naiyon lageyaa  o duniyaa chaar dinaan daa melaa duniyaa chaar dinaan daa melaa o duniyaa chaar dinaan daa melaa ho matthe bal na paaiye ho matthe bal na paaiye hoye kaun bhale kaun mande jag vichch kaun bhale kaun mande jag vichch sabanaa naal nibhaaiye sabanaa naal nibhaaiye threedots  jaggeyaa jaggeyaa jaggeyaa saannuu kaul ai sachchaa lageyaa jaggeyaa jaggeyaa jaggeyaa saannuu kaul ai sachchaa lageyaa  paapaan dii is nagarii andar kis de aib ginaaiye apane andar jadjad takiye apane andar jadjad takiye o threedots o threedots o threedots apane ton sharmaaiye threedots apane ton sharmaaiye  jaggeyaa jaggeyaa jaggeyaa saannuu kaul ai sachchaa lageyaa jaggeyaa jaggeyaa jaggeyaa saannuu kaul ai sachchaa lageyaa 
kudaa kare ke muhabbat men vo maqaam aaye,pakistanifilmafshan,1971,noorjehan,,tasleem fazli, kudaa kare ke muhabbat men vo maqaam aaye kisii kaa naam luun lab pe tumhaaraa naam aaye  tumhaaraa pyaar mere gesuuon kii ulajhan ho tumhaare naam se dil kaa charaag roshan ho sahar nazar se mile zulf le ke shaam aaye kisii kaa naam luun lab pe tumhaaraa naam aaye kudaa kare threedots  jahaan talak ye hasiin gunagunaatii raat chale nazar nazar se mile dil se dil kii baat chale hamaare dil kii tadap aaj kuchh to kaam aaye kisii kaa naam luun lab pe tumhaaraa naam aaye kudaa kare threedots  mere kayaalon kii tasaviir huubahuu tum ho mere huzuur nigaahon kii aarazuu tum ho nazar uthe merii jaanib koii salaam aaye kisii kaa naam luun lab pe tumhaaraa naam aaye kudaa kare threedots
saanson men kabhii,parchhaiyyan,1972,rafi asha,r d burman,majrooh, rafii saanson men kabhii dil men kabhii nazaron men rahaa karanaa jag bairii ho to kyaa tum hamase wafaa karanaa2  aashaa jaane pyaar nibhaanaa diiwaane dil kii lagii ke2 kyaa hai mohabbat zamaanaa ham se ye siikhe pyaar hamane kiyaa pyaar hamako sadaa karanaa saanson men kabhii dil men kabhii nazaron men rahaa karanaa jag bairii ho to kyaa tum hamase wafaa karanaa  rafii aaye kushiyon kaa mausam ki aaye gam kaa mahiinaa2 aashaa tumhiin pe maranaa tumhaare sangsang hai jiinaa rafii kabhii hoen naa judaa bas itanii duaa karanaa  saanson men kabhii dil men kabhii nazaron men rahaa karanaa aashaa jag bairii ho to kyaa tum hamase wafaa karanaa rafii jag bairii ho to kyaa aashaa tum hamase wafaa karanaa
saat ajuube is duniyaa men  dharamviir kii jodii,dharamveer,1977,mukesh rafi,laxmikantpyarelal,anand bakshi,  ra 	saat ajuube is duniyaa men aathaviin apanii jodii mu 	saat ajuube is threedots do 	are tode se bhii tuute naa ye dharamviir kii jodii 	ho ho ho 3 mu 	saat ajuube is threedots do 	are tode se threedots  ra 	koii tujhako de aavaaz to main boluun mu 	koii tujhe pukaare to main lab kholuun ra 	kyaa jiinaa aur kyaa mar jaanaa mu 	aisaa hotaa hai yaaraanaa do 	are chhodii yaaron ne duniyaa par yaar kii baanh na chhodii 	ho ho ho 3  mu 	ye ladakii hai yaa resham kii dor hai ra 	kitanaa gussaa hai kitanii munhazor hai mu 	dhiilaa chhod naa denaa hans ke ra 	rakhanaa dost lagaam kas ke do 	are mushkil se kaabuu men aae thodii dhiil jo chhodii 	ho ho ho 3 ra 	saat ajuube is threedots mu 	are tode se threedots ko 	aa aa aa  ra 	dukhsukh ke ham saathii hain ye vaadaa hai mu 	apanaa jo kuchh hai sab aadhaaaadhaa hai ra 	jo ye sachchaa vaadaa hai to sabkuchh aadhaaaadhaa hai to 	are raanii maan se mujhako bhii mamataa mil jaae thodii ko 	aa aa aa ra 	saat ajuube is threedots mu 	saat ajuube is threedots do 	are tode se threedots 	ho ho ho 3 ko 	aa aa aa 
insaan hanse yaa roe  kahaanii qismat kii,kahaani qismat ki,1973,mukesh,kalyanjianandji,rajindra krishan,  insaan hanse yaa roe jo honaa hai so hoe kyaa honaa hai kab honaa hai likhane vaalaa jaane kahaanii kahaanii qismat kii  ko 	kahaanii qismat kii  man hii man naadaan zamaanaa samajhe ke tadabiir badii hai ye na socho qadamqadam par raaste men taqadiir khadii hai haar hai kisakii jiit hai kisakii likhane vaalaa jaane kahaanii kahaanii qismat kii  ko 	kahaanii qismat kii  kabhii arsh hai kabhii farsh hai duniyaa kii riit puraanii kahiin pe saragam kahiin pe maatam har ik shai hai aaniijaanii kyuun sukhdukh ke mausam badale likhane vaalaa jaane kahaanii kahaanii qismat kii  ko 	kahaanii qismat kii  jiivan ke jitane din honge usamen ik din kam na hogaa jisane raaz ye jaan liyaa hai phir usako koii gam na hogaa kab tak lagaa rahe ye melaa likhane vaalaa jaane kahaanii kahaanii qismat kii  ko 	kahaanii qismat kii  hotehote bhii anahonii baat koii aisii ho jaae manzil par raahii jab pahunche dekhe to manzil kho jaae abhii haqiiqat abhii hai sapanaa likhane vaalaa jaane kahaanii kahaanii qismat kii  ko 	kahaanii qismat kii 
main pal do pal kaa shaayar huun,kabhi kabhi,1976,mukesh,khaiyyam,sahir, main pal do pal kaa shaayar huun pal do pal merii kahaanii hai pal do pal merii hastii hai pal do pal merii javaanii hai main pal do pal kaa shaayar huun threedots  mujhase pahale kitane shaayar aae aur aakar chale gae kuchh aahen bhar kar laut gae kuchh nagame gaakar chale gae vo bhii ek pal kaa kissaa thaa main bhii ek pal kaa kissaa huun kal tumase judaa ho jaauungaa vo aaj tumhaaraa hissaa huun main pal do pal kaa shaayar huun threedots  kal aur aaenge nagamon kii khilatii kaliyaan chunane vaale mujhase behatar kahane vaale tumase behatar sunane vaale kal koii mujhako yaad kare kyuun koii mujhako yaad kare masaruuf zamaanaa mere liye kyuun vaqt apanaa barabaad kare main pal do pal kaa shaayar huun threedots
khushiyaan hii khushiyaan hon daaman men jisake,dulhan wahi jo piya man bhaye,1977,yesudas hemlata banashri sengupta,ravindra jain,ravindra jain,  khushiyaan hii khushiyaan ho daaman men jisake kyon na khushii se vo diivaanaa ho jaaye aise mubaarak mauke pe saathii pesh duaaon kaa nazaraanaa ho jaaye khushiyaan hii khushiyaan ho threedots  der se samajhaa hamako zamaanaa shukr karo ki samajh to gayaa sang rahane kaa kvaab suhaanaa ban ke haqiikat saj to gayaa tum jo kaho to mahafil se kah de tum jo kaho to saarii mahafil se kah de pal bhar men mashahuur afasaanaa ho jaaye khushiyaan hii khushiyaan ho threedots  koii kyaa jaane ham ne kyaa kyaa khel rachaaye tumhaare liye ham bhii kaisii kaisii manzil chhod ke aaye tumhaare liye kaliyaan hii kaliyaan mahakaa do aise ki aabaad dil kaa ye viiraanaa ho jaaye khushiyaan hii khushiyaan ho threedots  hans ke hamarii har bhuul bhulaa denaa ham hain tumhare jab chaaho bulaa lenaa apanon kii is mahafil men ab kaam nahiin hai begaanon kaa ye duniyaa kyaa mol karegii ik mufalis ke aramaanon kaa itanii sii hai bas apanii tamannaa terii khushii se dil paravaanaa ho jaaye khushiyaan hii khushiyaan ho   threedots 
soii jaa taaraa leike apane khilaune,mastana,1970,kishor hemlata,laxmikantpyarelal,anand bakshi,  soii jaa taaraa aa soii jaa taaraa  leike apane khilaune sapane salone galiyan men aayaa ik banjaaraa soii jaa taaraa threedots  chhukchhuk donon chalen yauvan ke kheltamaashaa karen shor machaae dekho zaraa saa kheltamaashaa karen tuu bhii akelii main bhii akelaa tuu besahaaraa main besahaaraa soii jaa taaraa threedots  hamako roz galii ye aangan kitte akele laagen aaj tuu ghar aaii gariib ke ghar men mele laagen kaa boluun aage hamako to laage aaj ye kutiyaa uunchaa chaubaaraa soii jaa taaraa threedots  hamarii duhaaii badal ke raamaa la la la lorii banii dor ye phaansii kii dekho bhaaii jhuule kii dorii banii tuune to aay ke hans ke rulaay ke badal diyaa sansaar saaraa soii jaa taaraa threedots 
saanvare mat jaa mat jaa mat jaa,meera shyam,1976,lata,govindnaresh,narendra sharma, saanvare mat jaa mat jaa mat jaa raadhikaa araj kare kar jode  shyaam chale madhupurii raadhikaa  murajhaae madhuban men agan lagan kii man men duube  brajamandal ansuvan men saanvare mat jaa mat jaa mat jaa  dhenu chare trin nahiin shyaam bin baaje na venu rasiilii hariyaalii man brindaavan kii  padii virah men piilii saanvare mat jaa mat jaa mat jaa  chandra binaa kyon rahe chandrikaa praan binaa kyon kaayaa gyaan na jaane prem yoginii bhakti amaanii maayaa saanvare mat jaa mat jaa mat jaa
pukaaro mujhe phir pukaaro,buniyaad,1972,kishor lata,laxmikantpyarelal,anand bakshi,  ki 	pukaaro mujhe phir pukaaro 2 	mere dil ke aaiine men zulfen aaj sanvaaro la 	pukaaro mujhe phir pukaaro 2 	merii zulfon ke saae men aaj kii raat guzaaro ki 	pukaaro mujhe phir threedots  	gulashan men aisii chhaanv aisii dhuup nahiin 	kaliyon men aisaa rang aisaa ruup nahiin 	jo bhii mere yaar saa phuul koii le ke aao bahaaro 	pukaaro mujhe phir threedots  la 	chaandanii kii is andhere men zaruurat nahiin 	kuchh sochen kuchh dekhen hamako furasat nahiin 	jaao kahiin jaa ke chhup jaao aaj kii raat sitaaro ki 	pukaaro mujhe phir threedots  ki 	apane kvaabon kii jo duniyaa basaaenge ham 	aasamaanon se bhii aage nikal jaaenge ham do 	saath hamaare tum chalanaa ai rangiin nazaaro ki 	pukaaro mujhe phir threedots 
chaand jaise mukhade pe bindiyaa sitaaraa,saavan ko aane do,1979,yesudas,rajkamal,purushottam pankaj,  sab tithiyan kaa chandramaa jo dekhaa chaaho aaj dhiire dhiire ghuunghataa sarakaavo sarataaj  chaand jaise mukhade pe bindiyaa sitaaraa nahiin bhuulegaa merii jaan ye sitaaraa vo sitaaraa maanaa terii nazaron men main huun ek aavaaraa ho aavaaraa nahiin bhuulegaa merii jaan ye aavaaraa vo aavaaraa  saagar saagar motii milate pavrat pavrat paaras tan man aise bhiije jaise barase mahue kaa ras pyaase giiton kii gangaa kaa tuu hii hai kinaaraa nahiin bhulegaa merii jaan ye kinaaraa vo kinaaraa  kajaraare chanchal nainon men suuraj chaand kaa deraa ruup ke is paavan mandir men hansaa kare baseraa are kastuurii ko khojataa phirataa hai ye banjaaraa nahiin bhuulegaa merii jaan ye banjaaraa vo banjaaraa  chaand jaise mukhade pe bindiyaa sitaaraa nahiin bhuulegaa merii jaan ye aavaaraa vo aavaaraa 
kaanhaa bole naa kaanhaa bole naa,sangat,1975,lata manna de,salil choudhary,jaan nisar akhtar, kaanhaa bole naa kaanhaa bole naa puuchhuun baar baar kaanhaa bole naa kyaa hai priit kyaa hai pyaar kaanhaa bole naa  ban ke jyotii man men jhaanke yuun nayan nayan dole aake maanuun barase suurajavaa jamunaa kii dhaar pyaasaa man phir bhii pyaasaa rah jaae dekhe naahiin nayanaa priye khole naa kaanhaa threedots  mohan to man laharii re morii piidaa bhaii gaharii gaharii re banake sunii sunii sapane soe soe laage bainaa ye nainaa re khoe khoe aiso bedardii jaraa dole naa puuchhuun threedots  tan soe man jaage re miithii miithii agan koi laage re boluun chorii chorii man kii batiyaan torii kaahe jaane naa maane naa priitam morii kah re haarii main moraa ho le naa puuchhuun threedots
