Title,Film,Year,Singer,Composer,Lyricist,Lyrics
mere ishq men laakhon latake,mausam,1975,asha,madan mohan,gulzar,  mere ishq men laakhon latake balam zaraa hat ke 2 ho mere ishq men laakhon latake balam zaraa hat ke 2 haay haay haay maarungii aankh to niil pad jaayegaa main maarungii aankh to niil pad jaayegaa balam zaraa balam zaraa hat ke hat ke hat ke mere ishq men laakhon latake balam zaraa hat ke 2 ho mere ishq men laakhon latake balam zaraa hat ke 2  sutalii se patalii hai morii kamariyaa hay raam sutalii se patalii hai morii kamariyaa kamariyaa se baandhii hai maine gagariyaa gagariyaa naa chhalake zaraa hat ke hat ke hat ke  mere ishq men laakhon latake balam zaraa hat ke 2 ho mere ishq men laakhon latake balam zaraa hat ke 2  saukiin kahate hain chhappanchhurii hai saukiin kahate hain kahate hain kahate hain  saukiin kahate hain chhappanchhurii hai dil kii to achchhii hai aadat burii hai  2 aadii na honaa zaraa hat ke hat ke hat ke  mere ishq men laakhon latake balam zaraa hat ke 2 ho mere ishq men laakhon latake balam zaraa hat ke 2  baadaamii rang pe kuratii saraab kii haay haay baadaamii rang pe kuratii saraab kii sainyaan ne dekho merii aadat karaab kii mose naa lagaanaa zaraa hat ke hat ke hat ke  mere ishq men laakhon latake balam zaraa hat ke 2 hay re maarungii aankh to niil pad jaayegaa main maarungii aankh to niil pad jaayegaa balam zaraa balam zaraa hat ke hat ke hat ke mere ishq men laakhon latake balam zaraa hat ke 2 mere ishq men laakhon latake balam zaraa hat ke 2 
yaaraa o yaaraa main benaam ho gayaa,benaam,1974,narendra chanchal,r d burman,majrooh, o o o  yaaraa o yaaraa yaaraa o yaaraa ishq ne maaraa ho gayaa main to tujh men tamaam de rahe sab mujhe teraa naam main benaam ho gayaa 2  terii adaaen teraa hii jalwaa kaisii ye kaliyaan kaisii bahaar ab dil to meraa teraa nagar hai ye merii ankhiyaan hain tere dwaar ab main kahaan huun sab tuu hii tuu hai meraa man meraa tan meraa naam main benaam ho gayaa 2  kaajal dhul jaaye aansuu se aur rang dhule paanii se rang chadhaayaa mainne milakar us dilabarjaanii se suurat merii ruup hai usakaa ban gayaa ban gayaa meraa kaam main benaam ho gayaa 2 
bikaaner kii chunarii odhii,praan jaaye par vachan na jaaye,1973,asha,o p nayyar,s h bihari, biikaaner kii chunarii odhii  lahangaa pahanaa jayapur kaa haath men chuudii faizaabaadii aur merath kaa gajaraa ho gajaraa daal ke tere dil par main naachuun ho gajaraa daal ke tere dil par main naachuun 2  cholii merii ambaalevaalii jhilamil jisamen resham kii jaalii 2 jaalii se tan chamake chamakegaa  mukhadaa meraa damake are damakegaa baat bareliivaalaa daalaa donon  aankhon men kajaraa ho kajaraa daal ke tere dil par main naachuun ho kajaraa daal ke tere dil par main naachuun  chhalake chhalake saavar  ye aankhon ke dube jinamen iimaan laakhon ke 2 aise na dil machale machalenge  kaahe ko naa tadape tadapenge chaal javaanii kii mastaanii  dharam karam ye nakharaa ho nakharaa daal ke tere dil par main naachuun ho nakharaa daal ke tere dil par main naachuun 
mile kahiin do ajanabii,manchali,1973,kishore,laxmikantpyarelal,anand bakshi, mile kahiin do ajanabii ho gaii unamen dostii phir sunaa doston men ho gaii dushmanii   koii unamen bewafaa hogaa  2 koii dhokhaa ho gayaa hogaa sunaa hai fasaane ko pataa kyaa zamaane ko kisane kii berukhii mile kahiin threedots   ye ishaaraa kisakii jaanib hai  2 dil hamaaraa jisakii jaanib hai wo bhii ise jaanaa naa hamen pahachaanaa naa baat kyaa logon kii mile kahiin threedots   kisaliye ye aag se darataa hai  2 bachake sholon se guzarataa hai kaho dil diiwaane ko tere aashiyaane ko phuunkegii chaandanii mile kahiin threedots
kaalii palak terii gorii khulane lagii hai thodiithodii,do chor,1972,kishor lata,r d burman,majrooh,  	he he uun huun ki 	kaalii palak terii gorii khulane lagii hai thodiithodii 	ek choranii ek chor ke ghar karane chalii hai chorii la 	kaalii palak piyaa morii khulane lagii hai thodiithodii 	ek choranii ek chor ke ghar karane chalii hai chorii ho chorii 	kaalii palak piyaa threedots  ki 	aaegii baandh ke paayal tuu honth dabaae badan ko churaae 	naazuk qamar se lagaae adaa kii kataarii zaalimaan 	pheregii dhiiredhiire tuu mere gale par ye baanhon ke kanzar 	jaaegii dil meraa lekar samajh ke anaadii baalamaa 	roz raat ko yuun hii baandhegii laton kii dorii ho dorii 	kaalii palak terii threedots  la 	na to main dor se baandhuun naa jaal bichhaauun na tiir chalaauun 	naazuk qamar se lagaauun chhurii na kataarii saajanaa 	o sajanaa main to teraa dil luungii tujhase chhupaa ke nazar ko bachaa ke 	are yuun hii zaraa muskaraa ke kahuungii anaadii saajanaa ho saajanaa 	roz raat ko tere ghar hogii terii chorii ho chorii 	kaalii palak terii threedots  ki 	achchhii huii merii chorii ek dil khoyaa ek dil paayaa 	aise koii paas aayaa ki aa gayaa lutane kaa mazaa 	hans ke lipat gae donon bas gae donon huaa jab vaadaa pyaar kaa do 	roz raat ko milenge chandaa aur chakorii o chakorii ki 	kaalii palak terii threedots 
mujhase bhalaa ye kaajal teraa nain base dinrain,the train,1970,rafi lata,r d burman,anand bakshi,  ra 	mujhase bhalaa ye kaajal teraa nain base dinrain 	nii soniye 2 la 	ho chhod bedardii aanchal meraa ho gaii main bechain 	re soneyaa 2  ra 	naam kii tuu hai merii sajaniyaa naam kaa huun main teraa piyaa o 	reshamii lat se khele ye gajaraa duur se tarase meraa jiyaa 	naa naa la 	haan haan ra 	taubaa la 	taubaa kaisii 	naam hai premii paagal teraa to sang laage nain 	re soneyaa 2  	prem galii men hogaa na balamaa tujhasaa diivaanaa aur koii o 	chain udaanaa niind churaanaa siikhe tujhase chor koii 	naa naa ra 	haan haan gorii la 	kyaa hai sainyaa ra 	huun main to ghaayal teraa tadapuun saarii rain 	nii soniye 2 la 	chhod bedardii aanchal threedots  ra 	chaahe pavan ho chaahe kiran ho chhuune na duungaa teraa badan la 	jalataa hai man to man men chhupaa ke rakh le mujhe tuu mere sajan 	naa naa ra 	haan haan raanii la 	kyaa hai raajaa ra 	haan ruup barasataa baadal teraa pyaase hain nain 	nii soniye 2 
niile ambar ke tale do yahaan saathii mile,safed jhooth,1977,yesudas,shyamal mitra,yogesh, 	niile ambar ke tale 	do yahan saathi mile 	jhalake jhalake aramaan milaake lekar basane ghar chale 	niile ambar ke tale 	 	har ghadi bin raina 	chain ab ae naa 	man kahe mera saathi ab kahin jae na 	ye milan men koi ab sham na dhale 	niile ambar ke tale threedots 	 	zindagi men aise din kabhii ate hain 	rasmon ke bandhan men miit bandh jaate hain 	phir majake uthe hain tan ke phuul khile 	niile ambar ke tale threedots
kyaa huaa teraa vaadaa vo qasam vo iraadaa,ham kisise kam nahin,1977,rafi sushma shreshtha,r d burman,majrooh, kyaa huaa teraa vaadaa vo qasam vo iraadaa 2 bhuulegaa dil jis din tumhen vo din jindagii kaa aakhirii din hogaa kyaa huaa teraa vaadaa vo qasam vo iraadaa  yaad hai mujhako tuune kahaa thaa tumase nahiin ruthenge kabhii phir is tarah se aaja mile hain kaise bhalaa chhuutenge kabhii terii baahon men biite har shaam ke tujhe kuchh bhii yaad nahiin kyaa huaa threedots  o kahane vaale mujhako farebii kaun farebii hai ye bataa ho jisane gam liyaa pyaar kii khaatir yaa jisane pyaar ko bech diyaa nashaa daulat kaa aisaa bhii kyaa bevafaa ye tujhe yaad nahiin kyaa huaa threedots  bhuulegaa dil jis din tumhen vo din jindagii kaa aakhirii din hogaa kyaa huaa teraa vaadaa vo kasam vo iraadaa
apanaa desh videsh ke aage haath na phailaae,anokhaa,1975,mukesh,kalyanjianandji,indeevar,  apanaa desh videsh ke aage haath na phailaae aaj jahaan hai ret kal vahaan khet muskaraae  aisaa ki gaanvgaanv men gangaa laharaae apanaa desh videsh threedots  mehanat kaa hii naam hai vo jisako qismat kahate hain do haathon kaa khel hai vo jisako daulat kahate hain ham jahaan pasiinaa bahaaenge motii vahaan ugaaenge nadiyaan baandh nahar nikaalen kushahaalii chhaae apanaa desh videsh threedots  desh kii har chiiz hai apanii kyon apane haathon se toden isako bachaanaa farz hai apanaa kyon sarakaar par chhoden apanaa bhaarat saaraa hamen praantpraant hai pyaaraa aapas ke hii in dangon men desh na jal jaae apanaa desh videsh threedots 
matalab jo samajhe mere sandesh kaa,barood,1976,kishore,s d burman,anand bakshi, haa threedots  badaa hii khuubasuurat is jagah ka har nazaaraa hai  hai magar phir bhi kisii ka naam lekar dil pukaaraa hai   matalab jo samajhe mere sandesh ka matalab jo samajhe  matalab jo samajhe mere sandesh ka  is desh men hai koi kya mere desh ka  matalab samajhe jo mere sandesh ka   ye chehare ye aankhen  2  badale libaas rang ruup to vohii hai  yaadon ki chhaaon dhuup to vohii hai  2 kya phaayadaa kya phaayadaa phir is bheshh ka  is desh men hai koi kya mere desh ka  matalab samajhe jo mere sandesh ka  matalab jo samajhe threedots  vo maatii vo pani  2  aa mil ke phuulon kii baaten karenge  saavan ke jhuulon ki baaten karenge    2 mil ke sahen mil ke sahen ye gam paradesh ka is desh men hai koi kya mere desh ka  matalab samajhe jo mere sandesh ka  matalab jo samajhe threedots
prem kaa rog badaa buraa,dus numbari,1976,lata,laxmikantpyarelal,majrooh,  prem kaa rog badaa buraa maakaa nakaa ga baaii maakaa nakaa aisaa mere ko merii maan ne kahaa maakaa nakaa nakaa baaii maakaa nakaa prem kaa rog badaa buraa   ro ro ka kate ye din kahaan kal raaton ko rahuungii  nanhe se dil men baabaa kaise main ye dukh sahuungii kachchii kalii huun rang dekho zaraa dil dil dil bhii hai naazuk meraa prem kaa rog badaa buraa   phir bhii karuun main kyaa ki tuu badaa pyaaraa mohe laage par kaise teraa meraa milan ho tuu hii bataade abhii abhii abhii haath chhodo meraa dekho dekho dekho koii hai tiisaraa prem kaa rog badaa buraa  
akele hii akele chalaa hai kahaan,gopi,1970,lata,kalyanjianandji,rajindra krishan,  akele hii akele chalaa hai kahaan kahegaa kyaa kahegaa ye mausam javaan naa jaa naa jaa ho aajaa aajaa o raahii alabele hamasafar bhii koii saath lele  duur parvat pe kyuun ek badalii jhukii kyuun pavan chalatechalate chaman men rukii ek tanahaa kalii se ye kyuun kah gaii akele hii akele threedots  thandiithandii havaaon kii baat maan le kyuun nazaare tujhe roke ye raaz jaan le kaun detaa aavaaz pahachaan le akele hii akele threedots 
ghodii pe ho ke savaar chalaa hai duulhaa yaar,gulaam begum baadshaah,1973,rafi,kalyanjianandji,rajindra krishan,  ghodii pe ho ke savaar chalaa hai duulhaa yaar kamariyaa men baandhe talavaar akadataa hai chhailaa milii hai aisii lailaa ke jodii hai nahale pe dahalaa 2 ghodii pe ho ke threedots  kal tak bechaaraa ham saa kanvaaraa phirataa thaa galiigalii maaraamaaraa dekhii ek chhokarii phuulon kii tokarii bolaa dil thaam ke main haaraahaaraa yaar ko mubaarak ho muhabbat kii baazii 2 miyaan biivii raazii to kyaa karegaa kaazii 2 sadaa phuulephale donon kaa pyaar ghodii pe ho ke threedots  dulhan kii dhun hai kaisaa magan hai hogaa milan dekho abhiiabhii shaadii kii mastii lagatii hai sastii padatii hai mahangii bhii kabhiikabhii  ko  haanhaan padatii hai mahangii bhii kabhiikabhii  ye baat mat bhuulanaa pyaar kii bahaaren 2 nanhenmunnon kii lagaa dengii qataaren tab utaregaa jaa ke kumaar  ghodii pe ho ke threedots 
dil shaad thaa ke phuul  mujhe terii mohabbat kaa,aap aaye bahaar aayee,1971,rafi lata,laxmikantpyarelal,anand bakshi,  ra 	dil shaad thaa ke phuul khilenge bahaar men 	maaraa gayaa gariib isii aitabaar men  la 	mujhe terii mohabbat kaa sahaaraa mil gayaa hotaa 2 	agar tuufaan nahiin aataa kinaaraa mil gayaa hotaa ra 	mujhe terii mohabbat threedots  la 	na thaa manzuur qismat ko na thii marzii bahaaron kii 	 nahiin to is gulistaan men  2 kamii thii kyaa nazaaron kii 	merii nazaron ko bhii koii nazaaraa mil gayaa hotaa 	agar tuufaan nahiin threedots ra 	mujhe terii mohabbat threedots  ra 	kushii se apanii aankhon ko main ashqon se bhigo letaa 	 mere badale tuu hans letii  2 tere badale main ro letaa 	mujhe ai kaash teraa dard saaraa mil gayaa hotaa 	agar tuufaan nahiin threedots la 	mujhe terii mohabbat threedots  	milii hai chaandanii jinako ye unakii apanii qismat hai 	 mujhe apane muqaddar se  2 faqat itanii shikaayat hai 	mujhe tuutaa huaa koii sitaaraa mil gayaa hotaa 	agar tuufaan nahiin threedots ra 	mujhe terii mohabbat threedots 
nigaahen churaao na daaman chhudaao,faaslaa the distance,1974,bhupinder minoo purushottam,jaidev,kaifi azmi, bhu nigaahen churaao na daaman chhudaao      mere saath aao mere saath aao  mii mohabbat kii duniyaa basaao to aauun      vafaa ko vafaa kar dikhaao to aauun      vo chaandii kaa daravaa sone kii diivaar      bedard beruuh daulat kii duniyaa      use chhodakar tum jo aao to aauun  bhu vo sone kii diivaar main tod aayaa      vo daulat kii duniyaa main chhod aayaa      basaaenge duniyaa naii ab to aao      bichhaa diin hain nazaren qadam to badhaao      mere saath aao mere saath aao
main dhuundhataa huun jinako raaton ko khayaalon men,thokar,1974,mukesh,shamji ghanshamji,saajan dehlavi, main dhuundhataa huun jinako raaton ko khayaalon men vo mujhako mil sake na subah ke ujaale men  suhaanii pyaar kii baaten mere diladaar kii baaten kabhii iqaraar kii baaten kabhii inakaar kii baaten ek dard saa chhupaa hai dil ke hasiin chhaalon men main dhuundhataa huunthreedots  jo yuun barabaad hote hain vo kab aabaad hote hain dilenaashaad hote hain vo ek fariyaad hote hain ulajhaa huaa huun kabase gam ke ajiib jaalon men main dhuundhataa huunthreedots
do lafzon kii hai dil kii kahaanii,the great gambler,1979,asha amitabh sharad kumar,r d burman,anand bakshi, do lafzon kii hai dil kii kahaanii yaa hai mohabbat yaa hai javaanii  dil kii baaton kaa matalab na puuchho kuchh aur hamase bas ab na puuchho jisake liye hai duniyaa diivaanii yaa hai mohabbat yaa hai hai javaanii  is zindagii ke din kitane kam hai kitane hai kushiyaan aur kitane gam hain lag jaa gale se rut hai suhaanii yaa hai mohabbat yaa hai javaanii  ye kashtii vaalaa kyaa gaa rahaa hai koii ise bhii yaad aa rahaa hai jisake liye hai duniyaa diivaanii yaa hai mohabbat yaa hai javaanii  do lafzon kii hai dil kii kahaanii yaa hai mohabbat yaa hai javaanii 
kyaa ye zindagii hai,ye gulistaan hamara,1973,lata mangeshkar s d burman  chorus,s d burman,, comments sdb series lataa kyaa ye zindagii hai kaisii bebasii hai bolo kyuun khade ho gumasum 2   lataa sadiyon se yuun hii sar pe dukhataa bojh uthaaye in parabaton pe ham chal rahe hain bhuukhe nange pyaase laao haath apane saath laao haath apane saath chalke dekho do kadam tum kyaa ye zindagii hai threedots  kitanii hai duurii ham pade piiche tum badhe aage tumhen chhuu naa paayen tumhen chhuu bhii len to thukaraaye jaayen apanaa mel nahiin khel apanaa mel nahiin khel o baabuu kahaan ham kahaan tum kyaa ye zindagii hai threedots   ham ne ye maanaa ham to bure hain hamane kii buraaii tum to bhale ho tumane hamarii kii hai kyaa bhalaaii samajhaao sikhalaao samajhaao sikhalaao gale se lagaake hamen tum kyaa ye zindagii hai threedots
aap yahaan aaye kisaliye aapane bulaayaa isaliye,kal aaj aur kal,1971,kishore asha,shankarjaikishan,neeraj, a   aap yahaan aaye kisaliye k   aapane bulaayaa isaliye a   aaye hain to kaam bhii bataaiye k   haan haan haan pahale zaraa aap muskuraaiye a   muskuraane kii na koi baat hai k   ajii dekhiye to kyaa hasin raat hai a   oh kaam to bataaiye bataaiye k   na na na pahale zaraa aap muskuraaiye a   aap yahaan aaye kisaliye  k   tere binaa haay a   kyaa k   nind nahiin aatii hai a   achchhaa k   yaad terii aakar a   aahaa k   roz tadapaatii hai a   sachamuch k   apanaa banaalo a   a k   haath zaraa thaam lo a   vaah vaah vaah k   baar baar dekho naa a   kyaa k   dil se hii kaam lo a   are baabaa kaam to bataaiye k   kaam sidhaa saadhaa hai a   achchha k   aji lenaa ek vaadaa hai a   kyaa k   aajaa aajaa shaadii kaa iraadaa hai shaadii kaa iraadaa hai a   shaadii aur tumase k   haan haan shaadii kaa iraadaa hai a   shaadii naa baabaa naa k   magar kyon a   shaadii to barabaadii hai k   kyaa kahatii ho a   nahiin jaatii hai aazaadii hai k   nahiin nahiin monaa suno to threedots a   taa taa baai baai threedots k   oh ho aap yahaan aaye kisaliye aap ne bulaayaa isaliye aaye hain to kaam bhii bataaiye pahale zaraa aap muskuraaiye 
ai shahar ke logo sun lo ham pyaar se baaz na aayenge,shirin farhad pakistanifilm,1975,mehdi hasan,khurshid anwar,qateel shifai,     ai shahar ke logo sun lo ai shahar ke logo sun lo ham pyaar se baaz na aayenge tum jitane zakm lagaaoge ham utane jashn manaayenge shahar ke logo sun lo ham pyaar se baaz na aayenge sun lo ai shahar ke logo  tum laakh sitam iijaad karo dilawaalon ko barabaad karo ham pyaar kii haar na maanenge jo chaaho tum bedaad karo ham dilawaale diiwaane hain jo guzaregii sah jaayenge shahar ke logo sun lo ham pyaar se baaz na aayenge sun lo ai shahar ke logo  zakmon kii zabaan to koii nahiin bolegii magar gularang zamiin tapakegaa lahuu kaa jo qataraa aayegii sadaa shiirii shiirii shiirii shiirii ye naam sajaa kar honthon par ham giit wafaa kaa gaayenge shahar ke logo sun lo ham pyaar se baaz na aayenge sun lo ai shahar ke logo  tum kah do jaakar shaahon se in jhuuthe adalpanaahon se jab ishq hamaaraa machalegaa tuufaan uthenge aahon se is shahar pe bijalii tuutegii ye mahal bhasam ho jaayenge shahar ke logo sun lo sun lo sun lo sun lo 
o mitavaa badaraa chhaaye re,maan jaaiye,1972,lata,jaidev,naqsh lyallpuri,      o mitavaa mitavaa badaraa chhaaye re kaare kaare kajaraare  o mitavaa aa mitavaa ang lag jaa o mitavaa  aaii milan kii rut matavaalii 2 jhuum rahii hai bagiyaa saarii  kaliyaan mahake daarii daarii bhiigii bhiigii  chale puravaa re aa mitavaa threedots  ye saawan man bhaavan sang laayaa hai prem badariyaa rang daalo 2 sapanon ko chupake se milaake najariyaa baat yahii bas baat yahii sharmiilii kalii se kaanon men bhii kahe bhanvaraa re aa mitavaa threedots 
rut hai milan kii saathii mere aa re,melaa,1971,rafi lata,r d burman,majrooh,  la 	rut hai milan kii saathii mere aa re 	mohe kahiin le chal baanhon ke sahaare 	baagon men kheton men nadiyaa kinaare 	rut hai milan kii threedots  ra 	ho koii sajanavaa aajaa 	tere binaa thandii havaa sahii naa jaae aajaa 	rut hai milan kii threedots  la 	jaise rut pe hariyaalii gaharii chhaae mukh pe 	rangat nikhaar kii ra 	kheton ke sang jhuumen pavan men phulavaa sapanon ke 	daalii aramaan kii la 	tere sivaa ab to kuchh suujhe nahiin saanvare	 	rut hai milan kii threedots  ra 	o sajaniyaa jaan le le koii mose 	ab to laage nainaa tose 	aajaa o aajaa 	man kahataa hai duniyaa taj ke bas jaauun 	terii aankhon men la 	aur main gorii mahakiimahakii ghul ke rah jaauun 	terii saanson men ra 	ek duuje men yuun kho jaaen jag dekhaa kare 	rut hai milan kii threedots 
vaadiyon men kho jaaen ham tum  ye samaan hai suhaanaa,aarambh,1976,mukesh aarti mukherjee,anand shankar,shakeel ahmed, vaadiyon men kho jaaen ham tum aao in vaadiyon men kho jaaen  ham tum  2 ye samaan hai suhaanaa haan jii haan suhaanaa ho jaaen gumasum aao in vaadiyon men kho jaaen threedots  mujhe donon jahaan kii mil gaii hain kushiyaan tum jo mile hamaraahii mile dil kaa ye chaman phir lagaa muskuraane aramaanon ke hain phuul khile tum hii to ho sahaaraa haan jii haan sahaaraa chalate jaaen ham aao in vaadiyon men kho jaaen threedots  pyaaraa ye samaan hai mausam bhii javaan hai chaaron taraf husn kii daastaan hai mujhe lagataa hai jaise hamen dekhakar ye lagaa muskaraane zamiin aasamaan hai pyaar men ho ke diivaanaa jaise ye saaraa zamaanaa apanii dhun men gum aao in vaadiyon men kho jaaen threedots 
gumasum kyon hai sanam ab zaraa maan jaa,kasme vaade,1978,asha,r d burman,gulshan bawra, haan naa haan hothreedots  ho gumasum kyon hai sanam ab zaraa maan jaa pyaar kaa ye mausam hai aise men dil na jalaa  2 gumasum kyon hai sanam  2  jaane buujhe nazar churaaye dil kii baaten samajh na paaye o sitamagar dekh ab to ho jaa maharabaan  2 dard diyaa hai to de de davaa gumasum threedots  kab se hai beqaraar ye dil kab se kahatii huun jhuumake mil o anaadi ban khilaadi le le baahon mein  2 kaise piyaa se meraa palaa padaa gumasum threedots
ek din tum bahut bade banoge ek din,ankhiyon ke jharokhoon se,1978,hemlata shailendra singh,ravindra jain,ravindra jain, hemalataa ek din tum bahut bade banoge ek din chaand se chamak uthoge ek din shailendra sinh  hemalataa maan lo kahiin kii shahazaadii baithii ho tumhaare liye aankhen bichhaae aur use ye zid ho ki wo shaadii kisii se naa karegii tumhaare sivaay shailendra sinh  shailendra sinh ek din le gayaa tumhe jo koii ajanabii gair kii jo ho gaii ye zindagii hemalataa  shailendra sinh saans saans men tumhaarii kushabuu kis tarah jiyuungaa bolo tumako bhulaake dil pe jaan pe kar chukii ho jaaduu jaanatii ho puuchhatii ho phir bhii sataa ke hemalataa
roz akelii aae roz akelii jaae,mere apne,1971,lata,salil choudhary,gulzar, roz akelii aae roz akelii jaae 2 chaand katoraa lie bhikhaaran raat roz akelii aae roz akelii jaae  motiyon jaise taare aanchal men hain saare 2 jaane ye phir kyaa maange bhikhaaran raat roz akelii aaethreedots  jogan jaisii laage na soe na jaage 2 galiigalii men jaae bhikhaaran raat roz akelii aaethreedots  roz lagaae pheraa hai koii nanhaa saveraa 2 god men bhar do aaii bhikhaaran raat  roz akelii aae roz akelii jaae 2 chaand katoraa lie bhikhaaran raat roz akelii aae roz bechaarii jaae
teraa husn allaahallaah teraa ruup raamraam,five rifles 5 rifles,1974,kishor,kalyanjianandji,rajindra krishan,  teraa husn allaahallaah teraa ruup raamraam ek main hii nahiin tere karodon gulaam teraa husn allaah threedots  tuu jo palaken jhukaae himaalay jhuke tuu ishaaraa kare gangaajamunaa ruke terii zulfen sanvaaren kashmiir kii havaa dhoe kanyaakumaarii tere paanv sadaa teraa husn allaah threedots  aaj kitane dilon pe teraa raaj hai ye terii saadagii hii teraa taaj hai kyaa ajantaa kii main tujhako muurat kahuun tuu banaaras kii subah avadh kii hai shaam teraa husn allaah threedots 
pyaar pyaar  chaahie thodaa pyaar,lahu ke do rang,1979,kishor chorus,bappi lahiri,faruk kaisar,  pyaaaar pyaar pyaar pyaar pyaar chaahie thodaa pyaar thodaa pyaar chaahie  2 jaaneman gulbadan merii baat maanie chaahie thodaa pyaar threedots   chorii chhupe pyaar kabhii honaa chaahie rut ho javaan phir to hamen khonaa chaahie   2 jai kaalii kalakatte vaalii teraa vachan na jaae khaalii bachchaa log are bajaao taalii chaahie thodaa pyaar threedots   koii hasiin kar na sakaa meraa saamanaa merii nazar jaaduu bharii dil ko thaamanaa  2 jai kaalii kalakatte vaalii teraa vachan na jaae khaalii chhokarii log are bajaao taalii chaahie thodaa pyaar threedots 
juude men gajaraa mat baandho,dhoop chhaon,1977,rafi,shankarjaikishan,virendra mishra, juude men gajaraa mat baandho meraa giit mahak jaaegaa terii priit sulag jaaegii meraa pyaar chhalak jaaegaa  jitanii nazar jhukaaogii tum utanii nazar lagegii tumako nainon men kajaraa mat daalo koii raah bhatak jaaegaa  jab tum letii ho angadaaii dil kii dhadakan badh jaatii hai pairon men ghungharuu mat baandho koii saaz chahak jaaegaa  tere angon kii thirakan men pyaase giiton kaa saragam hai sajdhajkar itanaa mat dolo meraa raag bahak jaaegaa
achchhaa unhen dekhaa hai biimaar huii aankhen,shankar hussain,1977,aziz nazan babban khan chorus,khaiyyam,kaifi azmi, achchhaa unhen dekhaa hai biimaar huii aankhen murajhaaiisii rahatii hai ghabaraaiisii rahatii hain maashuuqon kii mahafil men sharmaaiisii rahatii hain kyaa jaane huaa kyaa hai patharaaiisii rahatii hain achchhaa unhen dekhaa hai biimaar huii aankhen  shokhii bhii lutaa baithiin mastii bhii ganvaa baithiin uthatii hain na jhukatii hain kyaa rog lagaa baithiin e yaar kyaa rog lagaa baithiin ki biimaar huii aankhen achchhaa unhen dekhaa hai biimaar huii aankhen  kis tarah hate dar se vaadaa hai sitamagar se kahatii hai lagan dil kii vo chal bhii chuke ghar se hai faasalaa dam bhar kaa phir dekh samaan ghar kaa vo hilane lagii chilaman vo pardaaedar sarakaa lo aa hii gayaa koii e yaar lo aa hii gayaa koii lo aa hii gayaa koii jo chaar huii aankhen  sarashaar huii aankhen sarashaar huii aankhen achchhaa unhen dekhaa hai biimaar huii aankhen  vo naqaab rukh se uthaae kyon vo bahaarehusn lutaae kyon sarebazm jalavaa dikhaae kyon tumhen ankhiyon se pilaae kyon ki vo apane nashe men chuur hai  jo nashe men chuur rahe sadaa use terii haal kaa kyaa pataa rahaa yuun hii dil kaa muaamalaa magar usakii koii nahiin khataa terii aankh kaa ye qasuur hai aankhon pe padaa pardaa e yaar aankhon pe padaa pardaa laachaar huii aankhen achchhaa unhen dekhaa hai biimaar huii aankhen  hamane aaj ek khvaab dekhaa hai khvaab bhii laajavaab dekhaa hai koii taabiir isakii batalaao raat ko aaftaab dekhaa hai  yaanii zindaa sharaab dekhoge husn ko benaqaab dekhoge raat ko aafataab dekhaa hai subah ko maahataab dekhoge chaandanii men uthii ghataa jaise daremaikhaanaa khul gayaa jaise ye fasaanaa sahii hasiin to hai nashe men rach gaii adaa jaise  koii tumasaa bhii ho na diivaanaa tum haqiiqat ko samajhe afasaanaa chaandanii usakaa rang zulf ghataa aur vo aankhen hain baademaikhaanaa maikhaane men pahunchii to e yaar maikhaane men pahunchii to maikhvaar huii aankhen gulnaar huii aankhen  achchhaa unhen dekhaa hai biimaar huii aankhen  sunate hain us dar pe jaake sar jhukaanaa manaa hai sar jhukaa bhii len agar to baith jaanaa manaa hai baith bhii jaaen kisii kone men to kyaa faayadaa jis taraf vo hon udhar nazaren uthaanaa manaa hai aur agar nazaren uthen to dardedil ko kyaa karen dardedil kaise mite aansuu bahaanaa manaa hai aur agar aansuu bahaaen bhii to vo dekhenge kyon aah bharanaa shor karanaa gul machaanaa manaa hai gul machaayaa bhii to matalab kis tarah samajhenge vo haay matalab saafsaaf un ko bataanaa manaa hai aur agar matalab bataayaa to bhii to vo denge javaab dil lagaayaa tum ne kyon jab dil lagaanaa manaa hai  dil kaa na kahaa maanaa e yaar dil kaa na kahaa maanaa dil kaa na kahaa maanaa gaddaar huii aankhen achchhaa unhen dekhaa hai laachaar huii aankhen laachaar huii aankhen maikhvaar huii aankhen achchhaa unhen dekhaa hai maikhvaar huii aankhen maikhvaar huii aankhen gulnaar huii aankhen achchhaa unhen dekhaa hai gulnaar huii aankhen gulnaar huii aankhen sarashaar huii aankhen achchhaa unhen dekhaa hai sarashaar huii aankhen achchhaa unhen dekhaa hai 
